{
  "repo": {
    "full_name": "yetone/native-feel-skill",
    "url": "https://github.com/yetone/native-feel-skill",
    "language": "",
    "stars": 1355,
    "forks": 61,
    "topics": [
      "agent-skill"
    ],
    "license": "MIT",
    "created_at": "2026-05-14T19:28:43Z",
    "updated_at": "2026-05-21T00:00:00Z",
    "homepage": ""
  },
  "content": {
    "title": "native-feel-skill",
    "tagline": "让跨平台桌面应用拥有原生质感",
    "points": [
      "四层架构: Native Shell -> WebView -> Node -> Rust",
      "八大构架原则",
      "WebKit/WebView2 生存指南: 70+ 坑及修复",
      "75 项审计清单",
      "Raycast Beta.app 逆向验证"
    ],
    "summary": "如果你的桌面应用需要跨平台+原生质感，先用75项审计跑一遍",
    "stats_text": "1355 Stars (7天新建)",
    "target_users": "桌面应用架构师、Electron/Tauri 开发者",
    "domains": "跨平台桌面开发、Agent Skill",
    "chartData": [
      {
        "label": "用户感知原生度",
        "value": 92,
        "previousValue": 35
      }
    ]
  },
  "script": {
    "full_text": "",
    "segments": [
      {
        "text": "跨平台开发 AND 接近原生性能——拒绝取舍。7天1355Star的Agent Skill。",
        "duration_est": 14
      },
      {
        "text": "如何让Electron应用拥有原生质感。四层架构——统一IPC schema贯穿所有层。",
        "duration_est": 16
      },
      {
        "text": "WebView生存指南。70多个坑，每个都有原因和修复。决策树清单先帮你排除不匹配场景。",
        "duration_est": 15
      },
      {
        "text": "如果桌面应用需要跨平台+原生质感，先用75项审计跑一遍。",
        "duration_est": 8
      }
    ],
    "total_duration_est": 53
  },
  "covers": {
    "3x4": {
      "prompt_zh": "深色抽象背景",
      "prompt_en": "Abstract dark"
    },
    "16x9": {
      "prompt_zh": "16:9 横向构图",
      "prompt_en": "16:9 horizontal"
    }
  },
  "publish_copy": {
    "titles": [
      {
        "full": "这个没有代码的仓库7天涨了1355个Star",
        "short": "零代码7天1355Star"
      }
    ],
    "body": "yetone/native-feel-skill",
    "tags": [
      "#AgentSkill",
      "#跨平台开发"
    ]
  },
  "meta": {
    "generated_at": "2026-05-21T10:50:00",
    "source": "gh-trending"
  }
}